{
  "schema_name": "longlineage.agent_task",
  "schema_version": "1.0.0",
  "task_id": "20260721-regional-cohort-aggregation-core",
  "owner_agent_id": "codex:root/cohort_receipt_core",
  "parent_task_id": "20260721-python-compatible-regional-all-datasets",
  "allowed_paths": [
    {"path": "state/tasks/active/20260721-regional-cohort-aggregation-core.json", "kind": "FILE"},
    {"path": "state/tasks/archive/20260721-regional-cohort-aggregation-core.json", "kind": "FILE"},
    {"path": "include/longlineage/compat/regional_cohort.hpp", "kind": "FILE"},
    {"path": "src/compat/regional_cohort.cpp", "kind": "FILE"}
  ],
  "depends_on": ["20260721-python-compatible-regional-topology"],
  "lease_state": "RELEASED",
  "lease_expires_at": "2026-07-21T16:10:00+08:00",
  "heartbeat_at": "2026-07-21T12:53:27+08:00",
  "task_type": "B",
  "goals": ["LL-G1", "LL-G2", "LL-G4", "LL-G5"],
  "status": "VERIFIED",
  "scope": {
    "completeness": "FULL",
    "description": "Implement a pure C++ fail-closed cohort aggregation core for exactly seven validated/frozen regional compatibility bundles and exactly seven exact Python crosswalk receipts; emit chart-ready JSON without BAM, hashing campaigns, science recomputation or Python calculations."
  },
  "assumptions": [
    "Dataset order is exactly HCC1395, HCC1395_DORADO, COLO829, H1437, H2009, HCC1937 and HCC1954.",
    "Only regional compatibility schema 2.0.0 bundles are valid cohort inputs; legacy 1.0.0 single-dataset evidence is rejected.",
    "Timing is copied from locked summary bytes; class and determinacy censuses are independently replayed from frozen regions.tsv and units.tsv without recomputing science.",
    "Peak RSS is optional because the current frozen bundle contract does not require it; absence is represented explicitly rather than imputed.",
    "The cohort claim ceiling remains false for formal topology, production release, clone/ancestor/time order and crosswalk mismatch tolerance."
  ],
  "inputs": [
    {"role": "validated_frozen_bundles", "path": "seven caller-supplied bundle roots", "sha256": null},
    {"role": "exact_crosswalk_receipts", "path": "seven caller-supplied crosswalk JSON files", "sha256": null}
  ],
  "expected_outputs": [
    {"role": "cohort_api", "path": "include/longlineage/compat/regional_cohort.hpp", "sha256": "0ff3b3f13bfad361967ae3aedc4a0f121b3f0deafe25722447dabd0bc1b3ffff"},
    {"role": "cohort_core", "path": "src/compat/regional_cohort.cpp", "sha256": "cedf69262215749d9b388536041a41d32fcd3e35806e203449a29666c3abdafe"}
  ],
  "step_verify": [
    {
      "step": "Parse and fail-closed validate all seven bundle and crosswalk identities and receipt bindings.",
      "verify": "Synthetic self-check accepts exactly seven canonical rows and rejects dataset-order, FROZEN binding, receipt binding, TSV SHA drift, nonzero-crosswalk and render-payload mutations."
    },
    {
      "step": "Aggregate only validated row/class/timing fields and render deterministic chart-ready JSON.",
      "verify": "Independent build exits 0; output contains seven ordered sample rows, exact cohort sums and all claim-ceiling flags false."
    }
  ],
  "evidence": [
    {
      "evidence_id": "20260721-regional-cohort-parent-build-replay",
      "evidence_path": "src/compat/regional_cohort.cpp",
      "evidence_kind": "TEST_LOG",
      "command": "/tmp/longlineage-cmake-3.31/cmake/data/bin/cmake --build <BUILD_ROOT> --parallel 4",
      "exit_code": 0,
      "output_excerpt": "Parent hardening replay: [100%] Built target longlineage_regional_compat after adding 18-check bindings and enforcing one common source-manifest path/run/SHA plus validator executable SHA across all seven samples at aggregation and render-time replay.",
      "evidence_sha256": "cedf69262215749d9b388536041a41d32fcd3e35806e203449a29666c3abdafe",
      "recorded_at": "2026-07-21T14:22:30+08:00"
    },
    {
      "evidence_id": "20260721-regional-cohort-synthetic-selfcheck",
      "evidence_path": "include/longlineage/compat/regional_cohort.hpp",
      "evidence_kind": "TEST_LOG",
      "command": "/usr/bin/c++ -I<REPO_ROOT>/include -O2 -g -DNDEBUG -std=c++17 -Wall -Wextra -Wpedantic -Wshadow -Wconversion -Wsign-conversion -Wformat=2 -Wundef -Werror=return-type -fno-fast-math -ffp-contract=off -Werror /tmp/regional_cohort_selfcheck.cpp <BUILD_ROOT>/lib/liblonglineage_core.a $(pkg-config --libs htslib jansson openssl) -pthread -o <BUILD_ROOT>/regional_cohort_selfcheck && <BUILD_ROOT>/regional_cohort_selfcheck",
      "exit_code": 0,
      "output_excerpt": "COHORT_SELFCHECK_PASS samples=7 regions=7 units=14 patterns=21 negatives=10; negatives include mixed source-manifest and mixed validator SHA at both aggregation and render boundaries.",
      "evidence_sha256": "0ff3b3f13bfad361967ae3aedc4a0f121b3f0deafe25722447dabd0bc1b3ffff",
      "recorded_at": "2026-07-21T14:25:30+08:00"
    }
  ],
  "deviations": [
    "Peak RSS is emitted as unavailable because it is not part of the validated regional bundle contract; no sibling time log is implicitly trusted or imputed.",
    "Crosswalk JSON files are exact C++ producer receipts bound to frozen bundle and Python corpus authority digests, but are not independently frozen; output wording explicitly preserves this evidence ceiling.",
    "Parent task hardened the completed core from 16 to 18 validator checks, added source-manifest plus validator-executable bindings, and fail-closed mixed-manifest or mixed-validator cohorts; scientific aggregation and claim ceilings were unchanged."
  ],
  "blockers": [],
  "updated_at": "2026-07-21T14:22:30+08:00"
}
