{
  "schema_name": "longlineage.agent_task",
  "schema_version": "1.0.0",
  "task_id": "20260719-method-performance-publish-audit",
  "owner_agent_id": "codex:root",
  "parent_task_id": "20260719-foundation",
  "allowed_paths": [
    {
      "path": "CHANGELOG.md",
      "kind": "FILE"
    },
    {
      "path": ".github/workflows/ci.yml",
      "kind": "FILE"
    },
    {
      "path": "CMakeLists.txt",
      "kind": "FILE"
    },
    {
      "path": "benchmarks/bgzf_writer_microbenchmark.cpp",
      "kind": "FILE"
    },
    {
      "path": "docs/CURRENT_FOCUS.md",
      "kind": "FILE"
    },
    {
      "path": "docs/audits/20260719_method_performance_output_audit.md",
      "kind": "FILE"
    },
    {
      "path": "docs/development/PERFORMANCE_AND_OUTPUT_POLICY.md",
      "kind": "FILE"
    },
    {
      "path": "docs/development/implementation-notes.md",
      "kind": "FILE"
    },
    {
      "path": "docs/decisions/ADR-0005-topology-ranking-separation.md",
      "kind": "FILE"
    },
    {
      "path": "docs/release/RELEASE_GATES.md",
      "kind": "FILE"
    },
    {
      "path": "governance/performance_benchmark.schema.json",
      "kind": "FILE"
    },
    {
      "path": "include/longlineage/artifact/bgzf_tsv_writer.hpp",
      "kind": "FILE"
    },
    {
      "path": "src/artifact/bgzf_tsv_writer.cpp",
      "kind": "FILE"
    },
    {
      "path": "scripts/ci/check_all.sh",
      "kind": "FILE"
    },
    {
      "path": "scripts/ci/check_performance_benchmarks.sh",
      "kind": "FILE"
    },
    {
      "path": "oracle/authority_manifest.json",
      "kind": "FILE"
    },
    {
      "path": "provenance/source_to_target_manifest.json",
      "kind": "FILE"
    },
    {
      "path": "state/tasks/active/20260719-method-performance-publish-audit.json",
      "kind": "FILE"
    },
    {
      "path": "state/benchmarks/20260719-bgzf-row-payload-local.json",
      "kind": "FILE"
    },
    {
      "path": "state/phase_ledger.json",
      "kind": "FILE"
    },
    {
      "path": "state/release_attestation.json",
      "kind": "FILE"
    },
    {
      "path": "tests/CMakeLists.txt",
      "kind": "FILE"
    },
    {
      "path": "tests/unit/test_runtime_solver.cpp",
      "kind": "FILE"
    }
  ],
  "depends_on": [],
  "lease_state": "ACTIVE",
  "lease_expires_at": "2026-07-19T16:00:00+08:00",
  "heartbeat_at": "2026-07-19T12:49:47+08:00",
  "task_type": "B",
  "goals": [
    "LL-G1",
    "LL-G2",
    "LL-G3",
    "LL-G4",
    "LL-G5"
  ],
  "status": "IN_PROGRESS",
  "scope": {
    "completeness": "FULL",
    "description": "Comprehensive repository-level audit of current LongLineage acceleration methods, historical comparable evidence, lossless data/output reduction, performance claim discipline and private GitHub publication readiness. This task does not substitute for the deferred seven-dataset P7 worker matrix or authorize scientific-kernel approximations."
  },
  "assumptions": [
    "Only same-scope measurements may support a numeric speed or resource-reduction claim.",
    "Frozen scientific decisions, RNG consumption, exact-test ceilings and topology completeness cannot be changed for performance.",
    "GitHub credentials must never be written into repository files or task evidence.",
    "GitHub publication is limited to a verified private liaoyoyo/LongLineage repository."
  ],
  "inputs": [
    {
      "role": "current_implementation",
      "path": "src",
      "sha256": null
    },
    {
      "role": "current_contracts",
      "path": "contracts/v1",
      "sha256": null
    },
    {
      "role": "current_artifact_catalog",
      "path": "schema/catalog.json",
      "sha256": null
    },
    {
      "role": "historical_authority_mapping",
      "path": "provenance/source_to_target_manifest.json",
      "sha256": null
    },
    {
      "role": "topology_vaf_handoff",
      "path": "external://InterSubMod/research/20260718_solver_methyl_edge_probe/20260719_最簡演化樹與VAF排序AI交接重點_01.md",
      "sha256": "7b412e89561924f0dff95a42bc69319b6d7e296ab30792cbe236a1bd16feb306"
    }
  ],
  "expected_outputs": [
    {
      "role": "method_performance_audit",
      "path": "docs/audits/20260719_method_performance_output_audit.md",
      "sha256": null
    },
    {
      "role": "performance_output_policy",
      "path": "docs/development/PERFORMANCE_AND_OUTPUT_POLICY.md",
      "sha256": null
    }
  ],
  "step_verify": [
    {
      "step": "Trace every current or planned acceleration to code, contract, historical evidence and a semantic-invariance condition.",
      "verify": "The audit distinguishes IMPLEMENTED, PLANNED and HISTORICAL_ESTIMATE rows and gives a repository path for every row."
    },
    {
      "step": "Select only lossless reductions that preserve frozen inputs, read eligibility, RNG consumption, exact tests, candidate families and output order.",
      "verify": "Every accepted optimization has explicit forbidden shortcuts and a Step-to-Verify gate with digest, count or resource metric."
    },
    {
      "step": "Verify repository governance and deterministic test evidence after documentation or bounded implementation changes.",
      "verify": "JSON schema checks, check-state, CTest and scripts/ci/check_all.sh exit 0; any deferred full-data claim remains a blocker."
    },
    {
      "step": "Repair GitHub CLI authentication without exposing credentials and publish only to the private remote.",
      "verify": "gh auth status exits 0, gh repo view reports PRIVATE, pushed branch commit equals local HEAD and a draft PR URL is recorded."
    }
  ],
  "evidence": [],
  "deviations": [],
  "blockers": [
    "SEVEN_DATASET_COMPARABLE_PERFORMANCE_MATRIX_DEFERRED_TO_P7",
    "GITHUB_AUTH_NOT_YET_REVERIFIED"
  ],
  "updated_at": "2026-07-19T12:49:47+08:00"
}
