{
  "schema_name": "longlineage.agent_task",
  "schema_version": "1.0.0",
  "task_id": "20260722-release-repair-and-publish",
  "owner_agent_id": "codex:root",
  "parent_task_id": null,
  "allowed_paths": [
    {"path": ".github", "kind": "DIRECTORY_TREE"},
    {"path": ".gitignore", "kind": "FILE"},
    {"path": "CHANGELOG.md", "kind": "FILE"},
    {"path": "CMakeLists.txt", "kind": "FILE"},
    {"path": "ROADMAP.md", "kind": "FILE"},
    {"path": "apps", "kind": "DIRECTORY_TREE"},
    {"path": "cmake", "kind": "DIRECTORY_TREE"},
    {"path": "containers", "kind": "DIRECTORY_TREE"},
    {"path": "contracts", "kind": "DIRECTORY_TREE"},
    {"path": "docs", "kind": "DIRECTORY_TREE"},
    {"path": "governance", "kind": "DIRECTORY_TREE"},
    {"path": "include", "kind": "DIRECTORY_TREE"},
    {"path": "oracle", "kind": "DIRECTORY_TREE"},
    {"path": "presentation", "kind": "DIRECTORY_TREE"},
    {"path": "provenance", "kind": "DIRECTORY_TREE"},
    {"path": "schema", "kind": "DIRECTORY_TREE"},
    {"path": "scripts", "kind": "DIRECTORY_TREE"},
    {"path": "src", "kind": "DIRECTORY_TREE"},
    {"path": "state/audits", "kind": "DIRECTORY_TREE"},
    {"path": "state/benchmarks", "kind": "DIRECTORY_TREE"},
    {"path": "state/phase_ledger.json", "kind": "FILE"},
    {"path": "state/project_state.json", "kind": "FILE"},
    {"path": "state/tasks/active/20260721-python-compatible-regional-all-datasets.json", "kind": "FILE"},
    {"path": "state/tasks/active/20260722-release-repair-and-publish.json", "kind": "FILE"},
    {"path": "state/tasks/archive", "kind": "DIRECTORY_TREE"},
    {"path": "tests", "kind": "DIRECTORY_TREE"}
  ],
  "depends_on": [],
  "lease_state": "RELEASED",
  "lease_expires_at": "2026-07-23T03:55:30+08:00",
  "heartbeat_at": "2026-07-23T01:19:01+08:00",
  "task_type": "C",
  "goals": ["LL-G1", "LL-G4", "LL-G5"],
  "status": "VERIFIED",
  "scope": {
    "completeness": "FULL",
    "description": "Reconstruct the unpushed LongLineage feature work on current origin/main without forbidden history, repair current-head CI/governance/hygiene regressions, comprehensively validate the truthful non-production scope, and publish a private draft PR without promoting blocked scientific phases."
  },
  "assumptions": [
    "The locked production input contract remains raw BAM plus exact latest HP/PS sidecar; no second persisted tagged BAM is required.",
    "Complete means complete verification of this draft publication scope, not false promotion of any P0-P8 project phase or the production release attestation.",
    "The source feature branch remains an immutable local recovery reference until the sanitized branch is independently verified.",
    "The publishable branch follows the repository fix/* naming contract and Python cache files remain ignored."
  ],
  "inputs": [
    {"role": "repository_governance", "path": "AGENTS.md", "sha256": null},
    {"role": "phase_state", "path": "state/phase_ledger.json", "sha256": null},
    {"role": "source_mapping", "path": "provenance/source_to_target_manifest.json", "sha256": null}
  ],
  "expected_outputs": [
    {"role": "ci_regression_fix", "path": "scripts/testing/test_agent_task_negative.sh", "sha256": null},
    {"role": "sanitized_task_state", "path": "state/tasks/active/20260721-python-compatible-regional-all-datasets.json", "sha256": null},
    {"role": "implementation_record", "path": "docs/development/implementation-notes.md", "sha256": null},
    {"role": "publication_task", "path": "state/tasks/archive/20260722-release-repair-and-publish.json", "sha256": null},
    {"role": "private_path_map_schema", "path": "schema/compat/regional_compat_input_paths.schema.json", "sha256": null},
    {"role": "history_hygiene_gate", "path": "scripts/ci/check_history_hygiene.sh", "sha256": null},
    {"role": "portable_report_qa", "path": "presentation/qa_static_report.py", "sha256": null},
    {"role": "declared_boost_dependency", "path": "cmake/Dependencies.cmake", "sha256": null},
    {"role": "dependency_lock", "path": "containers/versions.lock.tsv", "sha256": null},
    {"role": "hosted_ci_definition", "path": ".github/workflows/ci.yml", "sha256": null},
    {"role": "release_change_log", "path": "CHANGELOG.md", "sha256": null},
    {"role": "git_commit_build_binding", "path": "CMakeLists.txt", "sha256": null},
    {"role": "pinned_container_definition", "path": "containers/Dockerfile", "sha256": null},
    {"role": "dependency_lock_gate", "path": "scripts/ci/check_dependency_lock.sh", "sha256": null},
    {"role": "dependency_lock_negative_tests", "path": "scripts/testing/test_dependency_lock_negative.sh", "sha256": null},
    {"role": "audit_resource_lifetime_fix", "path": "src/audit/hcc1395_determinism.cpp", "sha256": null},
    {"role": "validator_resource_lifetime_fix", "path": "src/validation/artifact_validator.cpp", "sha256": null},
    {"role": "synthetic_provenance_separation", "path": "tests/CMakeLists.txt", "sha256": null},
    {"role": "live_focus_state", "path": "docs/CURRENT_FOCUS.md", "sha256": null},
    {"role": "project_state", "path": "state/project_state.json", "sha256": null},
    {"role": "private_draft_publication_audit", "path": "state/audits/20260722-release-repair-and-publish-001.json", "sha256": "7709d45fab7f1247dc93d7c06c022d17234dbd2c2b87b3cdc0c6038134a5a9ac"}
  ],
  "step_verify": [
    {
      "step": "Reconstruct the feature tree from current origin/main and remove every forbidden current-tree and reachable-history payload.",
      "verify": "Repository hygiene and an independent reachable-history scan both exit 0 with zero violations."
    },
    {
      "step": "Repair the current-head governance and negative-test regressions without changing scientific decisions.",
      "verify": "Compiled governance check-all and all 46 or later registered CTests exit 0 from a clean checkout."
    },
    {
      "step": "Run the full applicable compiler, sanitizer, schema, determinism, presentation and foundation verification matrix.",
      "verify": "Every applicable command has exit 0, immutable evidence, and blocked release-only gates remain explicitly blocked."
    },
    {
      "step": "Commit the reviewed scope, push the sanitized branch and open a private draft pull request.",
      "verify": "Remote head SHA equals local HEAD and the draft PR exposes successful current-branch Actions checks."
    }
  ],
  "evidence": [
    {
      "evidence_id": "PRIVATE_DRAFT_PUBLICATION_AUDIT",
      "evidence_path": "state/audits/20260722-release-repair-and-publish-001.json",
      "evidence_kind": "AUDIT",
      "command": "scripts/ci/check_audit_source_snapshot.sh state/audits/20260722-release-repair-and-publish-001.json && gh pr checks 4 --repo liaoyoyo/LongLineage",
      "exit_code": 0,
      "output_excerpt": "Implementation fa1249b9b8873c0b6bc099d8662bd87a62021e8c, tree 689842dc2b64d0e929454e0950d4917729e7e3619073d326f5f19059b22c2e2c; push and PR hosted matrices 9/9 PASS; repository PRIVATE and PR DRAFT; release phases remain governed and blocked.",
      "evidence_sha256": "7709d45fab7f1247dc93d7c06c022d17234dbd2c2b87b3cdc0c6038134a5a9ac",
      "recorded_at": "2026-07-23T01:19:01+08:00"
    }
  ],
  "deviations": [
    "The first hosted runs for commit b9797605cdc859e571c1961c1b4343c40d7c7183 exposed an undeclared Boost header dependency: all six compiler/sanitizer matrix builds failed before tests, while history hygiene and browser QA passed. The dependency is now declared in CMake, hosted CI, the production-image builder and the lock contract; failed runs are not completion evidence.",
    "Subsequent hosted runs exposed a Clang-only unused-constant warning, sanitizer-visible Jansson and BGZF lifetime leaks, and missing Git provenance/tooling in the deliberately .git-free container context. Each issue was repaired without changing scientific decisions; the failed hosted runs remain negative evidence only.",
    "Independent review rejected the initial shape-only source commit check because a fabricated 40-hex value or dirty checkout could be mislabeled. The repaired contract verifies clean HEAD when Git metadata exists, makes .git-free provenance an explicit trusted-CI assertion, and consumes the commit argument after stable dependency layers.",
    "The default conda Python environment lacked the jsonschema module; that invocation failed with an import error and is not evidence. The apt-managed /usr/bin/python3 validator accepted the same audit schema and instance with exit 0.",
    "The first PR attempt for the final implementation commit encountered a transient archive.ubuntu.com mirror timeout in the pinned-container job. The failed attempt remains negative environment evidence; attempt 2 completed all nine jobs successfully.",
    "The task was moved to archive before the strengthened remote assertion changed the audit physical SHA. Root synchronized the final SHA and timestamps after this lease was RELEASED. A new 20260723-private-draft-closure task was registered before any further correction write; this sequencing error is preserved without backdating or fabricating authority."
  ],
  "blockers": [],
  "updated_at": "2026-07-23T01:19:01+08:00"
}
